sentiment,text
2,"can help  Nondriverless cars kill 1,240,000 humans per year. 1MA  "
2,Perhaps the driverless car could pick up a sex worker? That would be fitting given the audience.
2,Nevada is one place driverless cars are being tested  the weather conditions make that an exciting place to test. cas13
2,"Trying to gauge the unintended consequences of driverless cars The Future of Driving, via  "
3,"I want the driverless car, and BAD. Seriously I would be happy if tomorrow morning there were no drivers behind the wheel."
4,"Automotive technology Driverless cars will reduce accidents, ease congestion."
2,just caught the show. I'm picturing driverless cab co's in NYC.. Those guys would be printing money.
2,Michigan is not going to sit by and watch that revenue take a dive because the law allows driverless cars.
2,Jerry Brown signed into law a bill that allows driverless vehicles to be in public streets in California. Welcome to the Future.
