sentiment,text
4,bullseye rt who loses from driverless cars? insurance companies because no one dies or crashes!
4,i want a driverless car now
4,since it is a speed limit driverless cars cannot be programmed to exceed it. this is going to be fun.
4,driverless cars are now legal in california. road head just became less dangerous. ladies come check out my robot car.
4,wish they'd hurry up and get those driverless cars on the road. this pushing the gas pedal and paying attention is getting old.
4,this is why we need driverless cars.
4,a k box on the roof turns your car driverless. pretty cool if they can get it to market.
4,i can't wait to get of those driverless cars. can you imagine?..i can. like otter said in animal house. road trip
4,thinking about programming a google driverless car to hunt for road kill while i sleep. road kill jerky for all!
4,we'd love to have driverless cars at ...would cut out biggest cost...make rides much cheaper codecon
4,do you trust driverless cars? i do as long as they use google maps
4,so if google glasses are banned for drivers just use a google driverless car!
4,really interesting article about the future of driverless cars and the transit system.
4,driverless cars are public transportation is done right and yes.
4,finally google has started making cars ! fully integrated driver less car prototype out there. no searing wheel. recode win
4,google driverless car uber best money bot ever
4,sign me up for one of the first driverless cars.
4,driverless cars are legal thats probably the most intelligent thing ever
4,i can't wait for the day i can drunkenly stumble into my google driverless car and tell it to drive me to texas.... then wake up there.
4,a driverless car invented by google has completed k miles and only had accidents when humans in other cars hit it.
4,can the google driverless cars drive my kids to soccer practice? that would totally help.
4,i'm fascinated by the idea of driverless cars. so's sen. risser who thinks wi could be a cold weather testing ground
4,cool! good video here driverless cars are coming whether we want them or not
4,google investing in driverless cars internet balloons and wearables. microsoft invests in a search engine? come on.
4,just saw a man being driven around in the passenger seat of a google driverless car. mindblown
4,a look at the cas floor as i wait for the driverless car presentation. sounds interesting!
4,google's driverless car is now safer than the average driver check this out for john!
4,swing by and pick us up! driverless car hits tampa bay road in test
4,would have been good for teddy andamp mary jo k. driverless car takes test run through dc...
4,wsj's auto critic dan neil on why driverless cars are inevitable and why that's a good thing roadsoady notickets
4,driverless cars humans are terrible drivers computers only have to be less terrible
4,driverless cars with no steering breaks. can't wait to have these as taxis. i can live with mph tops in nyc
4,free uber for you for me cause nyc will be safer for bikers when its full of their driverless cabs
4,actually i believe that less people will be nervous seeing the google driverless car come down the street than one with me behind the wheel.
4,challenge for driverless cars will be safer but higher proportion of crashes will result from manufacturer error.
4,just about the time the dmv says i can no longer drivei can still get around w a driverless car!
4,now i just need an aftermarket driverless car mod and mobile wifi
4,hey fbi driverless cars won't kill people. people will kill people.
4,wsj's auto critic dan neil on why driverless cars are inevitable and why that's a good thing so we can text?
4,wsj's auto critic dan neil on why driverless cars are inevitable and why that's a good thing
4,my robot driverless car and me. scifi future google googleplex w pic
4,as of august google driverless cars have driven a total of miles with only reported accidents both the fault of the human driver.
4,nerds galore! ca becomes nd state after nv to legalize driverless cars robot automotive kitt knightrider ai
4,we're about to get hands off with the driverless in las vegas. this is going to be an experience. ces cartech audi
4,one of google's engineers is developing a driverless car...amazing.
4,google's driverless car desperately needed in florida! codecon
4,fleet of driverless cars are way smarter than people. will find efficiencies in routes and rarely need to park in zones
4,i can't wait until driverless cars actually makes this true.
4,driverless.....uber!
4,why thinks driverless cars will lead to new d printing innovation.
4,driverless cars. i see a great future. just imagine what you could do during your commute. binge watch the latest netflix series. ces
4,driverless cars still a distant dream work faster google!
4,driverless car no problem. automatic sink and paper towel in a rest room and nothing works without vogueing.
4,ceo on board qualcomm sees potential in driverless cars eyesight for driverless cars. that is one market...
4,a trip in google's driverless car via googlecar futureride bring it soon!
4,sometimes when i see the google drive app on my phone i get really excited because i think it will summon a driverless car to take me around
4,driverless cars will make intersections so efficient it's scary
4,i can t wait until google s driverless cars take me on a less efficient route to my destination so as to pass by billboards deemed relevant.
4,i want one driverless vehicle. just like a pilot using autopilot. coming on . omg excited automotive
4,i can not wait for driverless cars to be the norm on highways!
4,congrats on all the press this week! could this toy pave the way to driverless cars?
4,i want a driverless car powered by apple maps. that is all.
4,go driverless to save on operating costs and increase frequency?
4,race for driverless cars is in full throttle google and other innovators say they may be just five years away...
4,i love that google got tired of retrofits on existing cars and said fuck it! we'll build our own driverless cars!
4,oh i you do me so wrong. driverless cars can't come soon enough...
4,i think the best argument for driverless cars is that we could eat tacos while commuting
4,good q but half of deaths from medical errors traffic deaths a year in the u.s. driverless car reduce number?
4,sorry i forgot all about it. their driverless cars are cool though. smwf
4,google self driverless car has buttons no steering wheel and no brake pedals. im definitely loving it. tech innovation
4,the driverless revolution rolls on sent from the cnnmoney app for android
4,google is at it again. would you feel safe in a driverless car? calif. gov. jerry brown does.
4,enjoyed your panel on saturday thanks for coming to ottawa! regarding driverless cars there s hope!
4,sees driverless cars being available to consumers in years boom for happy hours?
4,carlo ratti keynote driverless city will require less automobile infrastructure for the same mobility. yes please! urbanbigdata
4,driverless cars are going to take us into a new age just like how we transitioned from horses to cars.
4,love it google's newest driverless car has no steering wheel or gas pedal and only buttons start and panic
4,actually i am actually optimistic that driverless cars will really help car sharing. come to me zipcar...
4,driverless should also keep down operating costs right?
4,driverless cars will make buses andamp taxis unnecessary and will solve parking issues. kids will do more sports andamp activities too.
4,crazy it's possible we'll see the day when our drunkasses are being driven around by driverless taxis by
4,i need to move to britain! driverless cars to hit public roads in britain by january
4,happy th birthday google! too young to drive? no problem. we'll make driverless cars
4,tesla google and uber. tesla makes it sexy google makes it driverless uber makes it available. the future people.
4,google driverless cars freedom for the disabled?autism is just one example news roseville ca and sacramento metro
4,saw a driverless car on the highway and played ball with a former miami dolphin. todaywasagoodday fb
4,uber's future car fleet will be driverless cheaper uber technologies inc. envisions the future of its...
4,very cool. rt the streets of ann arbor will soon be filled with driverless cars
4,well the good news is parking space problem will be gone after we have driverless cars
4,how much revenue did google make last year? billion. billion. where will it be in yrs when glass and driverless cars mature? trillions?
4,nope. driverless cars quantum computing wifi blimps it's google who's planning world domination. and i'm okay with it.
4,i've been obsessed about driverless cars for a while now. the economist's september article is still worth reading
4,. dreams of owning mr bean type google driverless car. dreams of matt's bean imitation
4,warning nerd tweet. i'm really excited for the google i o keynote. they'll probably be talking about driverless cars wearables and glass
4,starting to save money now. elon musk in talks with google to bring driverless tech to tesla cars
4,the wave of the future. driverless cars with anti wreck technology. who needs insurance???
4,i boost driverless car see huge benefits esp more mobility for people who can't drive old young poor. but there is a downside nsa.
4,driverless electric cars are in uk by . wow!
4,i just really want said driverless car for this eight hour drive to nc.
4,eliminate caraccidents through driverless cars and roads. healthcare af q
4,street cars trollies bikes andamp driverless cars urban solution cc googcommercedev
4,saw a google driverless car today... a lexus rx hybrid...nice. i'm hoping that pilotless planes are next on the agenda. google tech
4,could play immersive driving games or simulations in driverless car. probably much more exciting.
4,taking a ride in a driverless car! furtherwithford ford test track
4,meet stanley a driverless car which successfully navigated and won a km off road race national
4,audi will be testing driverless cars on the expressway here in tampa tomorrow. pretty dope.
4,driverless cars could hit local roads by imagine being able to work on your laptop or video conference...
4,atlanta can t fix it s mass transit or urban sprawl issues. we re a car centric city. we should focus on driverless cars instead.
4,checking out the google driverless car. i guess you would call it a smart car. science!
4,finally google has started making cars ! fully integrated driver less car prototype is our there. no strafing wheel. recode
4,so...did apple buy and ? wasnt sure from the news. this other company is building driver less cars. way cooler.
4,this will blow your mind i have been wanting to say that how driverless cars remake our transit system
4,i like the numbers here how much will driverless cars really save us?
4,please hurry up with this driverless car thing before people that are texting kill us all! spotted on freeway this morning
4,dudes who like driverless cars are all over this.
4,to the solar roadway! pave the way to driverless cars! can't wait! thefutureisnow
4,from so far google's driverless cars have traveled miles autonomously and only accident reported. goog
4,driverless cars to be tested in california i'll soon fulfill my childhood dream of owning kitt!
4,goog driverless cars and tesla s ev technology could combine to be the ultimate car of the future
4,looking forward to the future of the driverless car. millenials will more readily adopt
4,can't wait for driverless vehicles to be the norm obviously we are a while away cause it's still spell checked as a word
4,where are these driverless cars? i could use one for this hour drive...
4,to keep pushing hard for driverless cars. they'll save millions of lives and billions of hours productivity quality time.
4,just saw a google driver less car zoom by on google campus!!!
4,wow just saw a google driverless car on . cool!
4,google unveils driverless car complete with no steering wheel this is crazy! watch both videos. mind blown
4,a look at how driverless cars will make intersections so efficient it's scary by
4,how driverless cars are here to stay and how many lives they'll save
4,google's driverless car is dope
4,score! california becomes second state after nevada to legalize driverless cars
4,sure but will look expensive next to driverless vehicles
4,sadly they're probably safer than most other cars driverless vehicle hits the streets of d.c.
4,i've been fascinated about this for a while. driverless caravans will be the future.
4,and their experimenting with driverless cars. nothing bad could come of that
4,things... . let's get driverless cars on the road first. . safety a must to account for bad drivers today.
4,driverless future far closer than anyone dreamed via let's hope so
4,my driverless cars will side swipe idiots on bicycles and stupid pedestrians.
5,is making driverless cars which is awesome
5,driverless cars will eliminate of traffic in crowded cities says mit
5,my first ever tweet while cruising in a driverless car. mindboggling sensorial experience. thx google. whoahorsey
5,hour drive ahead of me... driverless cars can't get here fast enough
5,less road rage rt the potential benefits of driverless cars are stunning
5,self driving cars? sounds good to me! headline california okays driverless cars
5,riding in a driverless car is on my bucket list this is so damn exciting. google
5,driverless taxis in nyc would probably be an amazing application.
5,i am so getting one! hurry up ky! with a push from google california legalizes driverless cars
5,google developed a driverless car. now that's fucking chill.
5,i want a driverless car so bad.
5,can't wait for driverless cars to come out! this is the first time i'm excited about motor vehicles in my entire life.
5,driverless shared cars will be much less expensive and much safer. will obey rules. can't wait! years?
5,driverless car appeals to me instead of the real estate chauffeur one can become
5,i want a google driverless car.
5,say word you can have a driver less car in california now... sweet
5,google 's stocks are already skyrocketing now the driverless are approved in ca !
5,driverless ? ooooh that would be awesome!!
5,burkhard bilger inside google s driverless car man i want a self driving car so badly!!
5,what a fun and exciting mental exercise to play thinking about the future of driverless cars killerapp
5,yes my yo daughter says she can't wait to have her own driverless car.
5,except trains are very capital intensive and have limited mobility. driverless cars are the best of both worlds
5,this is the future and it is now!! oh the places we will go!! can't wait for the driverless car. scichat
5,so much awesome! amazing video for google s next phase in driverless cars via
5,was awesome last night . seeing google's driverless car at stanford tonight. is this heaven?
5,driverless cars! love how google takes on big challenges and shares insights with students
5,so cool! score! california becomes second state after nevada to legalize driverless cars
5,google's new driverless car has no brake pedal or steering wheel via ... this is fantastic.
5,they're coming out with driverless cars.... i'm in
5,you could call a driverless car and tell the car it will take you there. whoo hoo
5,driverless cars...just think of the potential productivity andamp safety gains. via
5,these are to go on the google driverless cars i hope!
5,amazon prime air almost as incredible as google's driverless car
5,a driverless car?? i need to get me one of these
5,google survey just asked if i'd use a driverless car. i only wished they had an hell yes as a radio selection. cantwait takemymoney
5,i love these times from age of horse less to driver less travel google to build its own driver less cars
5,i would like to go for a drive with these guys. driverless cars will be the safest cars ever cas
5,at a session watching and listening to head of googles driverless car program. absolutely fascinating!!
5,wow! driverless vehicles? even in the streets of d.c.?
5,can't wait for driverless cars. soon we'll rarely drive and so many lives will be saved
5,driverless cars sound awesome but the actual economic impact is going to blow your mind.
5,the future of google...driverless cars...space elevators... mindblown
5,the driverless car is a great idea for someone like me who has an eye condition that makes me unable to drive a car.
5,automotive technology driver less cars will reduce accidents ease congestion.
5,total believe it google's driverless car is now safer than the average driver
5,skynet i am for driverless cars. sick of the accidents injuries deaths people driving recklessly all the time. it must stop.
5,jealous! own gets to ride in driverless car!! still ready here to beta one!
