sentiment,text
3,crash cars driverless cars loop at constant speed threatening to collide. snbto toronto
3,audi made a driverless car.
3,audi is testing their driverless car in tampa florida today. the license plate
3,this is how far driverless car technology has come cbcmtl
3,ann arbor driverless car test site gets industry partners by david runkassociated press detroit ap general...
3,driverless cars?! whaaaaaaa?
3,driverless cars now
3,already have driverless mine trucks in the pilbarra.
3,university of michigan is building a fake city for driverless cars technology futurology
3,when cars are driverless will police sirens be necessary?
3,google rolling out its own driverless car
3,how much do you tip a skynet six questions you should ask about driverless cars via
3,driver less car mod for your audi
3,where in the world have driverless cars driven? our map
3,true. i guess to work super reliably then everyone would have to be in driverless cars
3,google driverless car akin to a riderless bike? where would my bike want to go without me? answertounaskedquestion
3,is this guy driving with his ipad? google driverless car punks nyc does it again!
3,moving to wisconsin are driverless cars legal in your state? check out this map
3,inside google s driverless car
3,a review of one the driverless cars at ces ces
3,are the feds cool with driverless cars? bbgnbt
3,driverless cars are the compatibility mode between trains and unwalkable suburbs until we can retrofit them all.
3,google innovating a driverless car....
3,ford commercial just claimed it uses driverless technology during the spurs game. yeah use that term while you can. googlescoming
3,the driverless car storyline is the most mike judge element of 's silicon valley yet. very office space or idiocracy.
3,the current state of driverless cars
3,so i had an idea for f teams can field a third car but it must be driverless no human input allowed. totally autonomous.
3,michigan is not going to sit by and watch that revenue take a dive because the law allows driverless cars.
3,what's a future impact for insurance? driverless cars fleeing parking lots before a hail storm. ha! iasa possibilities workhumor
3,me driverless cars in andlt yrs internet lol wrong reality
3,companies soon to optimize high fuel costs with driverless vehicles already legal in ca nv fl. supplychain google
3,google's new driverless car has no brake pedal or steering wheel
3,to the dreamers google announces driverless cars in less than years. would you buy one of those? followusandgrow
3,driverless cars legal in cali
3,when driverless cars take over will old people set theirs to go really slow?
3,you've heard of driverless cars but what about carsthatfeel? check it out! letsgoplaces
3,on driverless cars amazing govt's not looking seriously risk b big move white elephant onpoli
3,interesting take on what driverless cars will mean. the future of driving via fb
3,driverless cars. bill ridingroughlywest
3,great scott! i thought goggle would have the first driverless car. will you show this in class? are you in or ?
3,new law allows driverless cars on michigan roads lansing wwj ap gov. rick snyder has signed a law allowing...
3,buy the new google driver less car and expense it to pearsonspecter
3,secrets to google driverless cars!
3,what google's driverless car future might really look like by
3,shows off driverless car tech in florida with along for the ride.
3,the driverless car
3,psa trains are driverless cars in much the same way as airplanes are space shuttles. rt that again and get blocked reported for spam.
3,that's only currently. as society moves towards urban centers and driverless cars do you think that will affect handheld sales?
3,jerry brown signed into law a bill that allows driver less vehicles to be in public streets in california. welcome to the future.
3,drivers on making k yr driverless car is a multi decade transition. let's take a breath and i'll see you in the year
3,google s next phase in driverless cars no brakes or steering wheel via
3,google's driverless car. the grey thing on top is a scanning laser that rotates times a second to
3,university of michigan builds fake city for driverless car testing
3,this is all my car needs google's newest driverless car has no steering wheel or gas pedal and only buttons start and panic
3,week in review new law allows testing of driverless cars duggan picks cabinet members foresee acquired ...
3,can't be worse than drivers who text. rt video driverless cars headed to california roads sara welch reports
3,funny will saudi women be allowed to not drive a driver less car? saudi drivingban
3,u m center breaks ground on facility to test driverless vehicles ann arbor officials from a public private...
3,interior of the driverless car featuring the big red button that i didn't push.
3,the google driverless car. at pic
3,driverless cars ? honda ? said no one ever ! really worldpeaceinstead
3,ethier' andamp 'driverless' are now trending in la
3,driverless cars and jevon's paradox
3,google's driverless cars are expected to become legal on california roads today.
3,good read but ignores trucking industry driverless cars are further away than you think
3,the first driver less car was just made.
3,has no one seen irobot? robottakeover w a push from google california legalizes driverless cars
3,soondriverless technologies will find their way to the trucking industry. read this article. follow us
3,driverless fedex trucks loaded with drone packages that launch when close to destination.
3,that's exactly what will happen with driverless cars. salesman will literally live on the road.
3,driverless cars ubiquitous wireless internet andamp electricity growing andamp printing organs... lenr next? thefutureisnow thesingularityisnear
3,google's driverless car part . when?
3,i m not sure. i think it would defeat the perception of driverless cars but elec cars r pretty much just cars.
3,driverless cars will soon be making their way through the streets of the u.k.
3,yeah man search up driverless audi a parks itself.
3,think of your driverless car as a very friendly horse. it can do without you but chooses to let you have control
3,oh was it a google driverless car?
3,driverless cars now street legal in california
3,what could possibly go wrong? rt helicopter drones and driverless cars now working in tandem
3,uk government announces that driverless cars will be allowed on public roads for trials..... this shouldn't be a issue smh
3,in the process of buying a car and i keep thinking how this might be the last gas car i ever buy. and the last one that isn't driverless...
3,driverless cars?
3,what google's driverless car future might really look like by
3,oh and maybe we can pay amazon with bitcoins made with a d printer assembled by a robot in our driverless car yeah
3,started here in nevada! how google got states to legalize driverless cars
3,get bezos on those amazon drones for the cap america shipping. or the driverless car.
3,driverless white house too driverless car takes test run through dc...
3,also today on do you think driverless cars are a good idea? cbcmtl
3,not driverless but very promising considering it's classified as a bike and is legal on roads
3,wall e world is getting closer andgt andgt with a push from google california legalizes driverless cars nyt
3,imagine if the zip car drove to you information technology and innovation foundation president on the reality of driverless cars.
3,makes you think. could people at the auto show years ago have imagined a presentation on driverless cars? cas
3,why trucks will drive themselves before cars do driverless cars googlecar
3,can the cops give a car a ticket?? driverless cars have just started hitting the roads in california!!
3,are we ready for driverless cars? pbs newshour
3,a beautiful day for a driverless vehicle presentation with house tandamp i. transportation
3,can i borrow a driverless car to take me to bread co?????
3,will driverless cars solve our energy problems or just create new ones?
3,mercedes driverless car
3,could driverless cars change everything? techtuesday
3,google building truly driverless car with no brakes steering wheel gas pedals
3,google's trillion dollar driverless car part how google wins
3,rt driverless cars could arrive in ann arbor in automotive michigan
3,ktla consumer confidential stock market rally internet sales tax? driverless technology when not reporting for...
3,california will start granting licenses for driverless cars in september via
3,'s driverless car will still drive better than most massachusetts drivers eh ?
3,i drove to work today but by my car will drive me! tune into find out when u can ur driverless car
3,nissan developing driverless cars in sunnyvale sunnyvale cbs sf scientists at nissan s new research facility...
3,iowa county says yes to driverless cars driverlesscars autonomous cars selfdrivingcars
3,jake and i had an interesting conversation about driverless cars the other day.
3,. can driverless cars handle torrential rain? like every summer afternoon afternoon in florida? tested yet?
3,driverless cars for ? this startup is challenging googlewith a simple sensor tech
3,dmv hosts norcal workshop to create rules for driverless cars san jose cbs ap with auto officials saying...
3,no. uber will be driverless cars. it's a natural progression uber drivers will be disrupted.
3,tesla talks partnering with google for driverless cars tesla motors is considering adding driverless technology...
3,california trend setting. gov brown signs bill clearing use of driverless cars on public roads
3,snyder wants michigan to approve driverless cars michigan gov. rick snyder said google's driverless car is...
3,is there a driverless car in your future? driverlesscar driverless
3,how google got states to legalize driverless cars about four years ago the google team trying to develop cars...
3,google jumps into the top ten patent recipients powered by wearables robots and driverless cars google pushed...
3,what doesn't kill us makes us stronger andlt google driver less cars and antifragility
3,sebastian thrun google's driverless car ted short video about why this matters it's more than sudoku
3,that's just a normal day kevin. wait until you see the driverless google car. welcome to silicon valley.
3,watching presentation by google vp sebastian thrun lead of the driverless car!
3,how will driverless cars affect our cities?
3,hisum khosla's mom saw a doctor at the birth of her children andamp at age for the first time. driverless car is more complex solved problem
3,the driverless road ahead
3,users do things you don t anticipate. driverless car demo to halt by hitting kill switch video
3,can help non driverless cars kill humans per year. ma
3,google forced to add steering wheels to driverless car designs
3,driverless cars in the streets of d.c.? dc driverlesscars
3,this startup is challenging google's driver less car with a simple sensor
3,this is how i imagine driverless googlecars will end up parking all over the place.
3,california will start issuing driverless car licenses in september. iot connectedcar ibminnovate
3,sergey brin unveils new google driverless car prototype
3,inventing tomorrow s jobs dprinting driverless drones timebroker future awesome tech
3,google driverless cars blindabilities via
3,the demand for cars is greater than human availability to drive cars safely and efficiently. hence driverless cars for hire.
3,meet the sensor that could make cars driverless
3,you mean to tell me we have driverless cars but vacums still sound like kingkong ? why...
3,ann arbor could get driverless vehicles by the university of michigan is working with auto industry and...
3,finally california will start granting licenses for driverless cars in september by
3,a driverless car invented by google has completed ovr k miles andamp had accidents when humans hit it
3,detroit auto show u m to build fake downtown to test driverless cars the testing site will be built on what...
3,gov. brown gives green light to driverless cars in california chicago tribune
3,qualcomm wants to make eyes for driverless cars
3,besides drone? via google driverless car?
3,with a push from google california legalizes driverless cars
3,dmv seeking input of rules for driverless cars dozens attended a workshop friday where dmv officials were...
3,driverless tech first comes carriage ... then the law gary anglebrandt although a few states michigan...
3,so how many of these driverless taxi can accommodate for typical american traffic patterns w o spaces for parking?
3,seen at driverless cars zooming our way quick somebody call denzel!
3,!!!! with a push from google california legalizes driverless cars
3,steeri world's st driverless car app via
3,uk paves way for driverless cars
3,mt driverless cars n self driving seat googleme bigdocc am
3,google's driverless car.
3,just caught the show. i'm picturing driverless cab co's in nyc.. those guys would be printing money.
3,california may soon have driverless cars. are you game?
3,yep things google's tiny new driverless car looks like totoro
3,massachusetts institute of technology ford to work on driverless car the massachusetts institute of technology...
3,what should prevent us from watching vids in driverless cars? cars will safer w out us drunk texting
3,google's moonshot idea use driverless cars in cities as a public health initiative to eventually phase out fatal accidents by human error
3,i just heard a rumor that a driverless test car just drove by my office. i need to spend more time outside....
3,ha i can see that! or driverless cars that run on sidewalks belt line? thoughts supernovasouth
3,desoto cab announces the first driverless taxi.
3,q will google's driverless cars be programmed as kantians or utilitarians? will need to design for lots of ethical edge cases cc
3,what happens to car insurance in a driverless car world? time for auto insurance companies to innovate
3,while you were sleeping driverless cars just got a little bit closer to mainstream.
3,daily talker flying car or driverless car? a company in woburn hopes to have the first flying car in production...
3,first jetson s reference during driverless car discussion! cas
3,if your in the driversseat of driver less car so your not driving per say can you now text ?
3,no fun eh? driverless cars are becoming reality could be on british roads next yr
3,can't wait to survey the insanity of drivers flipping off driverless cars.
3,the uk just threw down the driverless car gauntlet
3,ever wondered what a driverless car sees? googlecar nightlife
3,once we have driverless cars the ghost community can actively rejoin society by operating motor vehicles without causing suspicion
3,google unveils a driverless car bbcgofigure
3,google buys nest google makes driverless cars google makes phones... google takes over the world. google
3,danah boyd writes that any new tech panics those used to the status quo. what will cause next panic? driverless cars? rheadd
3,google s driver less car and morality
3,florida aims to lead driverless car revolution via
3,senator calls driverless cars the cure to the disease of vehicle related deaths sayfie flapol
3,uber ceo expect driverless cars record funding round in the future uber technologies inc. envisions the future...
3,i suppose i should have said apparently georgia already has driverless cars.
3,driverless cars and bicycle sculptures nuitblance toronto nathan phillips square
3,flightless drones! ahh. dmv seeking input of rules for driverless cars
3,tmlt though also said today that they will eventually replace their drivers with driverless cars
3,california sets regulations for testing driverless cars
3,says of her experience in google's new driverless car i wanted to drink. i wanted to text and drink. codecon
3,cnbc says ca insurance companies are requiring ride sharing cars to carry more expensive insurance. driverless cars are coming too.
3,continental has been testing a driverless car in nevada too.
3,goodbye peter gregory. i hope they have driverless cars in heaven.
3,i didn't think about these scenarios in the driverless world should your driverless car kill you to save a child?
3,ever vigilant dc cops pull over google's driverless car. amazingly no one was injured.
3,is this the answer d or ? tampa summit to feature driverless cars as transit option
3,levanowski google driverless car in god we trust all others bring us data energyideas
3,a testament to vision ruthless execution andamp growth hacking. can provide global consistency...some day it will be driverless
3,just reported driverless cars are now legal in portions of california! wtf? driverless before flying cars?!!!
3,in auto news driver less cars can now be tested on michigan roads.
3,google's driverless cars no brakes or steering wheel coming to streets this year. google
3,uk to rewrite road laws to pave way for driverless cars yessssss
3,california okays driverless cars
3,part of me doesn't want to like this part of me knows it's the future. a lap in ford's driverless transit van.
3,the design inspiration for google s new driverless car
3,disrupt comfort andgt andgt larry page defends google's 'big bets' on glass driver less cars
3,can ber partner with google driverless vehicles
3,if you are in sf maana get educated on the commercialization of the driverless car by . my fav
3,and you thought the new iphone was hi tech...with a push from google california legalizes driverless cars via
3,is google's new driverless car the future of driving?
3,california okays driverless cars can i take mine in a vw beetle and call it herby?
3,too late detroit driverless cars are here
3,ride sharing is eating taxi industry for lunch. drivers jumping ship. course wont be long before etc. operate driverless fleets.
3,rt breaking news ca cancels driverless cars on state hwys as the cars were driving to tx and tn in search of a better life.
3,ann arbor could get driverless vehicles by the university of michigan is working with auto industry and...
3,dmv seeking input of rules for driverless cars
3,gov. brown gives green light to driverless cars in california chicago tribune
3,cruise driverless cars.
3,california will start granting licenses for driverless cars in september
3,no i just saw one and had some thoughts about driverless cars and mobile isolation cells and dystopia
3,burkhard bilger inside google s driverless car via
3,ibminnovate expanding system complexity internetofthings driverless cars are coming!
3,nope because google invested m in uber. they will have the driverless cars
3,economic impacts of driverless cars ignores demand elasticityimpacts on sprawl co oil use if driving is cheaper
3,attention danish tweeps will be on danish tv dr morgen around am dk time talking about the societal impact of driverless cars. tune in!
3,dmv releases draft rules for driverless cars the california department of motor vehicles has posted draft rules...
3,we hop in a driverless car and head back to the googleplex for another day of googleallstars. another feast. i have the eggs again.
3,has better 'driverless' car solution than ...
3,driverless car in nathan phillips square snbto
3,driverless cars now street legal in california
3,driverless cars coming.
3,reading driverless cars could cripple law enforcement budgets colin neagle
3,when will google win their first driverless formula race?
3,you can always ask the driver for your rating. hopefully we don't have to worry about this when the driverless cars come out.
3,perhaps the driverless car could pick up a sex worker? that would be fitting given the audience.
3,driverless cars to hit public roads in britain by january
3,google's retrofitted driverless car captured googleplex
3,if i can take a ride in a driverless car on a public street theb i see no reason why my building can't wiggle a little g.lynn archwhims
3,true. is l driverless yet?
3,ca sb must be amended to provide that google's driverless cars gather only the data necessary to operate vehicle
3,i believe in the driverless world your auto insurance will be cheap but if you still want to drive it'll be x cost of driverless
3,looked like googles driver less car but it was only this
3,this company is claiming that it will upfit your car to driverless starting next year.
3,me too. my goal is to have google do this before my kids start driving susan wojcicki on driverless cars me too
3,uk plans to allow driverless cars on public roads starting in january what could possibly go wrong?
3,did you know that designed a driverless car? this is the future. check it out here
3,to continue to follow andamp their vision for driverless cars check out the new group set up at i'd try one.
3,funny to think texting and driving with no hands is in our future thx to driverless cars.
3,i'm thinking of it something like a preview of the inevitable asimo falls over video for the driverless car
3,car worthy of jacques tati via google reveals driverless car prototype
3,driverless cars bill signed by gov. jerry brown nearly years to the day after the jetsons debuted on abc f...
3,if a driverless car gets pulled over for speeding who pays the ticket?
3,this startup is challenging google's driverless car with a simple sensor
3,dmv seeking input of rules for driverless cars dozens attended a workshop friday where dmv officials were...
3,florida wants to be hq for driverless cars some might say we already are
3,amazon drones delivering d printed floor mats to my driverless car that is authenticated by my nymi ecg wristband. all paid for by bitcoin!
3,google unveils a prototype of its new driverless car. it has no steering wheel or diver pedals.
3,just saw a google driverless car!
3,google's plans for a driverless car this morning on with
3,inhabitat michigan is building a fake acre city to test driverless cars.
3,. driverless logistics education event! networking education and baseball
3,when driverless cars break the law there is little doubt that the technology behind driverless cars is nearly...
3,watch out!! google's driverless car now permitted on california roadways by
3,it s driverless! thing could run on cute baby seals wouldn t be part of initial news. googs is from ca not mi expected
3,driverless rides headed for detroit?
3,google plans to launch driverless cars by next year dailyfinance
3,a real driverless car. a company determined to drive change.
3,the same day google shows off a driverless car apple decides algorithms aren't stirring people enough and spends b on hand curated music.
3,yes but will they fly!? rt driverless cars could be cruising california roads by spring via
3,thought inspiring driverless cars andgt impact will be tremendous on jobs. will people hate siliconvalley when scale hits home? svforum
3,this startup is challenging google's driverless car with a simple sensor kinect...
3,how google got states to legalize driverless cars via we need these!!
3,maybe munis will have a medallion concept to enroll driverless cars as part of some annual oversight or compliance.
3,the uk will allow driverless cars on public roads in january of
3,if driverless cars reduce fatalities there may be added pressure on d printing tech to supply transplant organs
3,was just talking about this the other night with . it only makes sense that the driverless car is a tesla.
3,it's . i can own a driver less car but i still can't edit a tweet.
3,driverless cars are supposed to be taxis though. not personal vehicles.
3,carmakers driverless cars need legal framework by ryan nakashima ap business writerlas vegas ap the future...
3,yes could driverless cars solve distracted driving?
3,google is launching internet balloons and driverless cars. apple is introducing dark mode. nail andgt coffin.
3,hang on dusty eyes stops me from getting in another driverless car. i checked a bag. you can do that on a private jet? he shrugs.
3,how will driverless cars affect our cities?
3,california will start granting licenses for driverless cars in september
3,google testing driverless cars in ca??
3,check out the latest in driverless cars here cbcmtl
3,from driverless cars to driverless aerial vehicles .. a goog experiment to attract talent in the near term.
3,driverless cars!! ilovenuitblanche snbto toronto lovenuitblanch lovetoronto art kia
3,driverless car delivered by drone?
3,really thoughtful take on potential impact of driverless cars via
3,driverless cars get green light for testing on public roads in uk
3,google is serious about driverless cars.
3,nope of americans would ride in a driverless car if possible. would you?
3,rt google forced to add steering wheels to driverless car designs
3,driverless cars in florida sooner than we think.. what fox
3,your btr hit for this week regarding driver less cars can be seen here
3,the future is here driverless cars...
3,i suspect uber and lyft want to be the way you order a driverless car to take you somewhere.
3,uber will go driverless.
3,where are you going to park this driverless car? will you be able to park this driverless car for free?
3,driverless cars allowed in uk as soon as january autonews
3,ceo steve mollenkopf shares his thoughts on driverless cars andamp more at codecon. here's mines terminator!
3,just met a driverless car at an intersection
3,tech talk tonight by jeff johnson of driverless cars andamp rosey the robot pm info east . hosted by
4,sit back and nap and play board games and watch netflix while our driverless car takes us across country where do i buy?
4,clean safe andamp it drives itself!! this weeks economist's special report on the future of the car. driverless!? yes please
4,google driverless car. this changes everything in business. google googledriverlesscar dmv
4,can i interest you in something in blue? mt google's driverless car good news for bad drivers
4,driverless cars?! i want one
4,fbi warns driverless cars could be used as lethal weapons because regular cars can't right?
