sentiment,text
1,car wars action sci fi drew goddard 'in the future driverless cars become sentient and turn on the human race'. blackoutlist
1,good. i still won't even do self check out driverless cars are further away than you think
1,watched the video now that i'm home from work. wtf. i thought we were getting a driverless car not some orwellian big brother shit.
1,so google has a driver less car? they can take the steering wheel away from my cold dead hands before i buy one.
1,aren't they already? fbi warns driverless cars could be used as 'lethal weapons'
1,google developing a driverless car??? da facckk?!
1,driverless cars ? what's the point ?
1,driverless cars now street legal in california ... a good reason to leave ca... no one is behind the wheel
1,they're on about driverless automated cars why waste the money? get a fucking taxi
1,google driver less car is not viable insurance companies would have no part of it.
1,also cars with drivers fbi warns driverless cars could be used as 'lethal weapons'
1,thanks for share. driverless cars won't make us thinner healthier happier driverless cars and sprawl
1,the driverless cars take us to the wrong spot. says damn robots. i agree. we board a bus. delucchidoesgoogle
1,being systematically run over by driverless cars.
1,driverless cars are terrible. how can anyone be a fan of them. i mean c'mon!!!
1,oh hell no i know enough about computers to not trust a driverless car
1,driverless cars?!! wth!i honestly don't think that's a good idea..
1,durham driverless car causes crash in nc two people injured dur
2,i am the google driverless car today i keep not going where i intend to go.
2,what could possible go wrong? california governor brown signs bill clearing use of driverless cars on public roads
2,the driverless car revolution should not begin with cars via
2,cannot jus trust the emergency brake got block those wheels or a driverless truck barrels into
2,ok can we talk about how the us doesn't wanna approve google's driverless cars because of speeding ticket profits
2,one driver less car works more than one not going to happen.
2,google's driverless car will need more testing watchdog group warns
2,could technology lead to unemployment? it's no secret that smart machines think google's driverless cars ...
2,beats driverless cars. rt google said to deploy wi fi blimps in africa and asia. goog
2,detroit unhappy with google's push for driverless cars tech cars
2,driver less cars using google maps what could go wrong?
2,driverless cars wtf!?!?
2,must develop policies now to prevent this. toyota official driverless cars could encourage sprawl
2,they want us to believe a self driving car malfunctioned but this is a google street view car not a driverless car.
2,when driverless cars crash who s to blame? via anonymous
2,driverless cars great but they aren't sustainable without an honest energy policy. per capita energy use defines the future.
2,not only are there legal regulatory concerns with driverless cars there s a matter of societal trust. goodpoint cas
2,my feeling is that driverless cars are an inferior solution to other already existing tech
2,this story is everything... rudderless congress breaks driverless car via
2,business insider the fbi is afraid criminals will use google's driverless cars for freeway shootouts goog
2,hooli did it first. google's newest driverless car has no wheel or pedal and buttons start and panic
2,seems like driverless cars are a scam to put into google andamp software giants instead of infrastructure for all trains .
2,we already have driverless cars they're called fucking public transportation.
2,the fbi is worried driverless cars will be used as bombs looks like driverless cars are now dead.
2,driverless cars ? i think i'm about done with the world! i can't deal. google is coming out with everything
2,rt why driverless cars won't save the environment by
2,fbi driverless cars could make criminals more dangerous. also criminals are more dangerous in cars than on horses!
2,driverless cars are now apparently an election worthy issue? seriously florida?
2,that's true but i think many claims about impact of driverless cars rely a bit on assumptions of random usage rather than peaks
2,driverless cars and iphones are more important than securing the ocean as a water supply desalination
2,safety a concern for driverless cars
2,driverless cars by . yeah...like they're gonna let all that dui money just cruise off into the skynet sunset. policestate
2,the driverless cars took is to the wrong spot. says damn robots. i agree. we board a bus. delucchidoesgoogle
2,driverless cars could increase pollution warns
2,we don't need driverless cars to decrease our dependence on fossil fuels no connection
2,california where drugs and driverless cars are legal!
2,until you try to put driverless trucks on highway in a snow storm. then that idea kind of goes to hell.
2,go read literally anything about how transit planning works before talking about how counterproductive and useless driverless cars are.
2,key issue in a catastrophic accident with driverless cars does your car decide whether you or andgt other people die?
2,m year parking revenues at risk with driverless cars. why park for when you can send the car elsewhere? plans?
2,the driverless car headless horse
2,yeah but this is google. not a tupperware meetup. you can build a driverless car but can't set up high capacity wifi?
2,hmmm i wonder what the insurance would be on a driver less car? yeah not practical.
2,no on the driverless truck for now andamp boone s nat gas truck idea is ! be like havin bombs drivin with lil people next em !
2,driverless car rolls down hill blocks in lower queen anne bouncing off parked cars. nobody hurt. liveonkomo
2,google driverless car will not stop at a free puppy sign. bob lutz bigpicture
2,acnuit i'm seeing crash cars by alain declercq. there are two driverless cars. sometimes they become almost about to crush
2,every time i read a story about driverless cars i just get a shiver down my spine. am i alone in this??
2,driverless car!? i think not!it will b a clstrfk of lawsuts! whose fault will it b? this just crzy! it was a joke story rite?
2,colorado driverless car bill shelved until further notice a bill to allow driverless cars on colorado highways was...
2,google reveals a driverless car? for me it will be passenger less. i don't trust technology that much...
2,on notes that state laws have not kept up w technology not just on the driverless car issue
2,tear driverless cars are further away than you think
2,fbi says driverless cars good for surveillance but could be used as deadly weapons the fbi's thoughts on...
2,many scenarios concerning civil rights spying espionage and corporate exploitation ensue with driverless cars. futuretalk
2,sorry i know driverless cars are a great thing i just worry they'll reduce ins entice on actually improving infrastructure.
2,news flash we already have driverless cars they're called subways.
2,. working w google on algorithms for driverless cars to annoy bike riders. mirrortap rtredlightroll crosswlkignore kidding
2,can someone please explain the point of driverless cars? seems like a solution looking for a problem to me. we already have taxis
2,driverless cars show the problem with utilitarianism and who should die if an accident occurs
2,i just woke up from falling asleep on the couch had the craziest dream that google made driverless cars... say it ain't so...
2,a look at the roadblocks facing driverless cars
2,why is the driverless car prototype a prius? that is a bad ideer.
2,i'm skeptical about the driver less cars too. i'd be freaked out by an empty driver seat
2,why do they take great concepts for cars driverless andamp electric and make them so intentionally unappealing..
2,do i think the google cars are great looking no but i do think that type of design when all cars are driverless is more likely than not
2,ploop! fbi warns driverless cars could be used as 'lethal weapons'
2,no it won't because i refuse to own one. a driverless car will be the first real robot you'll own.
2,betting on driverless cars is cool if you want to be underwater for a decade or two.
2,attitude of innovation driverless cars put taxis out of biz?foster more w less
2,gov brown's press conference was set in a dystopian future where billionaire cyborgs unleash armies of driverless cars
2,driverless taxis concern me. what about ranting and cursing? who will listen to me? gartnersym
2,this auto insurer is not happy about a future of driverless cars.
2,brave new world andgt driverless cars will make police chases 'lethal'
2,what intersections would look like in a world with only driverless cars. i literally winced the whole time...
2,we're heading into a jobless future no matter what the government does exampledriverless cars taxis deliveries
2,barrier to driverless cars insurance liability. who's cause of accident?
2,terrorism threatens my driverless car now? ugh! the fbi is worried driverless cars will be used as bombs
2,driverless car rolls backwards out of parking space crashes into pillar outside town andamp country entrance. bainbridge
2,driverless robo cars seems no fun to me
2,only in sf do taxi drivers realize their jobs likely won't exist in years because of driverless cars. candidconversations
2,if driverless cars dont end the world i dont know what will.
2,oops eleanor holmes norton stalled her own driverless car ride
2,love the picture nytimes picked for the driverless car legalization story google car in crosswalk with people in front
2,autonomous civil aircraft could be flying before cars go driverless andlt aw hell no.
2,ugh driverless cars are coming but they'll bring congestion and more fuel consumption
2,i don't actually want a google driverless car i would much rather ride one of these to work instead
2,watched a segment on it once. i just don't trust 'self driving' cars but yet i ride our driverless rapid transit here.
2,google's driverless car is now safer than the average driver i will never get one of these. i drive.
2,driverless cars mean more miles driven higher fuel consumption. transportation
2,a driverless car is one step closer to losing our freedom and privacy. another way to monitor us.
2,how do you insure a driverless car? the hurdles they'll face
2,driverless trucks will make all these hours of service debates very silly when we look back on it in years freight nasstrac
3,after the driverless car the driverless marriage. hear it out based on each other's data input computer creates conversation
3,google's new driverless cars robo taxis no brake pedal or steering wheel taxi google
3,will driverless cars provide disruption in the overshot car market? less superfluous stuff to sell to a less involved ego cheaper cars.
3,open data and driverless buses how london transport heads to the future great innovation story.
3,so they are gonna legalize marijuana and driverless cars?
3,this week in bots google's driverless cars sure but are you ready to fly with a robot pilot?
3,i'm really curious what impact driverless cars will have on transportation and car ownership in the future.
3,learning about the politics and processes of passing the laws legalizing google's driverless cars. way worth tuition
3,crazy. google unveils a driverless car bbcgofigure
3,and you do have the driverless steering less google car..yes?
3,had a dream last night about a rotary phone and a driverless car retrofuture
3,me and and saw a driverless car today on chicago ave.
3,cruise automation driverless cars for ? this startup is challenging googlewith a simple sensor via
3,nevada is one place driverless cars are being tested the weather conditions make that an exciting place to test. cas
3,driverless cars coming to u.k. in london cnnmoney for the first time driverless cars will soon be...
3,uber plans to use driverless cars when available
3,hey so does my life! google's newest driverless car has no steering wheel or gas pedal and only buttons start and panic
3,there's a crowd outside milling about waiting for the driverless cars. i find dusty eyes. rough night? he asks. delucchidoesgoogle
3,did lurch yesterday really say who ever is driving a driverless car pull up here?
3,tesla considers driverless cars in partnership with google amazing
3,google driverless car and skype translate discussion on necn via
3,the solution for parents who have to drive the kids driverless cars?
3,trying to figure out how to spoof contents of car to driverless cars nobel prize winners in car at all times.
3,driverless car day parked because of cab protest traffic near the capitol. members wishing they could ride. cc
3,a driverless cars has explicitly and implicitly a different set of needs and wants it becomes more a tool and less a fashion choice
3,future premier california will allow driverless cars on their roads in years. will bc embrace the future and do likewise?
3,posit newly revived urban streetcars fail as automated driverless tech emerges. regional commuting is still the strongest case for rail.
3,the driverless car tipping point is coming soon
3,rt another state just approved driverless cars
3,warren buffett said if google's driverless car catches on then insurance providers like geico would be negatively affected so his point is?
3,will be at in weeks! any new ces trends you want us to talk about? driverless car? d printing? time travel?
3,like the idea of adding bitcoin to internet traffic to give first class priority or driverless cars paying one another to pass
3,google brings its driverless car to austin there s a driverless vehicle in town. no we re not talking about the...
3,fbi warns that driverless cars could be weaponized
3,driverless cars will be available in andlt years causing drop in traffic
3,at high speed on the road to a driverless future
3,driverless car rules drafted by california the california department of motor vehicles has posted draft rules...
3,mass transit based on driverless cars is coming! helsinki's ambitious plan to make car ownership pointless
3,so the saudi market is preparing for driverless cars. that's one way to prevent women from driving nobody needs to drive. womensrights
3,wondering if driverless cars will trigger totally new designs for cars in a future?
3,rangers. driverless cars. david frum. this is twitter right now and i don t like it one bit.
3,driver less cars the modern horseless carriage. fb
3,how much longer will it be before equips nyc with driverless cabs? will you welcome or oppose this change?
3,california governor brown signs bill clearing use of driverless cars on public roads video yes
3,driverless car bill aims to smooth technology fast lane dustin walsh the michigan legislature isn't taking a...
3,have you heard that the driverless car is now street legal in not only nevada and florida but california too?
3,strong illustration of the ethical questions ahead of us andgt andgt should your driverless car kill you to save a child?
3,california signed a bill to permit driverless cars on the road. bill was entitled the asians off the road act
3,driverless car bill is signed in california at google headquarters
3,about to close the upper deck of selmon expy for driverless car testing. express lane selmon
3,your nightmare is google monetizing driverless cars with promoted destinations and lingerie stores get ad budgets .. yeah ..
3,uk to allow driverless cars on roads
3,the us is ready to make a billion bet on driverless cars technology
3,just read google unveils new driverless car prototype
3,ann arbor could get driverless vehicles by ann arbor wwj ap the university of michigan is working with...
3,driverless cars driving by themselves... can you imagine it? so insane
3,video california legalizes google s driverless cars. ha! you said it wouldn t happen.
3,wait. driving a car as a non citizen is illegal but a driverless car is legal? nobody andgt somebody? what a world. h t to
3,it's like woody allen's sleeper come true! a first drive google driverless car
3,fbi concerned about criminals using driverless cars via
3,google driverless cars. somewhere hasslehoff is putting on his shades.
3,google unveils driverless car what could possibly go wrong?
3,. likes to brag about all the jobs its creating while promising it'll use driver less cars asap by
3,i saw one of these this weekend in phoenix driverless cars we should question and challenge google but not as haters
3,hi ! do you guys have driverless cars yet? general motors world headquarters
3,hey googlegirl tell me you got to ride in one of those driverless cars
3,driverless car! google
3,molecular scanners on your smartphone glow in the dark trees andamp affordable driverless cars? is the future.
3,fun to hear thoughts on the future driverless cars new interfaces cyborgs! xcon
3,just a guess no driverless car team in that office just all evil stuff like ads.
3,driver less cars are coming and they can see cyclists coming too carlton reid safety
3,tesla talks partnering with google for driverless cars tesla motors is considering adding driverless technology...
3,these over a bynes or lohan car right? driverless cars now street legal in california
3,one of my professors worked at apple on the first iphone andamp now works at google on google glass andamp driverless cars. life. officially. made.
3,ann arbor a test bed for driverless cars? university of michigan researchers work to make ann arbor the
3,time for driverless vehicles driverless
3,britain to test driverless cars next year london british officials says driverless cars will be tested on...
3,driverless cars and jevon's paradox.
3,we need to understand that driverless cars do not remove humans from the equation.
3,google's new driverless car has no brake pedal or steering wheel not cool.
3,also on driverless robot cars a boon to mankind or a slippery slope to economic failure and class warfare? cbcmtl
3,top line ces takeaways driverless cars drones and headphone headphones headphones...
3,driverless cars means having no one to flip off...
3,actually google has a project called google x and it's making driverless cars and shit like that.
3,can we at least agree on driverless uber?
3,they made a driverless car
3,driverless cars are on the way.
3,uk to put driverless cars on public roads by january by
3,has the time finally come for the driverless car?
3,moral machines the driverless car dilemma
3,bump for great justice rt how driverless cars could reshape automobiles and the transportation system
3,two more things that i think are the future of automotive technology heads up displays and driver assist. bringing us closer to driverless.
3,driverless cars verses drones for your future delivery?
3,google's newest driverless car has no steering wheel or gas pedal and only buttons start and panic ha
3,gadgets that stood out priced from . to from driverless cars to tvs that can watch you companies...
3,no comment response on solar roadways in correlation to the google driverless cars. i'm taking that as a yes. integrate
3,legislators and regulators have started to establish rules of the road for the use of driverless cars. thefuture
3,driverless cars to get california licenses starting in september. here we go!
3,the warning signs from the future driverless taxi
3,google to build prototype of truly driverless car google plans to build and launch onto city streets a small...
3,rt driverless cars to use apple maps fivewordtechhorrors
3,driverless car nohands us james lick fwy
3,home automation and driverless cars are the future. google is now a leader in both. in years automated cars will be the norm.
3,. driverless cars
3,university of michigan builds fake city for driverless car testing via
3,google to build prototype of truly driverless car google plans to build and launch onto city streets a small...
3,cruise automation is releasing a cheaper sensor roof dispositive to compite with the driverless car of google
3,audi is stepping into the driverless car game
3,a car that drives itself?sounds awesomely futuristicbut is it safe?heres how it works driverlesscarces
3,dmv ponders how to regulate driverless cars california must set guidelines by .
3,as google dreams of driverless cars the israel defense forces deploy them. israel
3,much like corporations driverless cars are people!
3,. techpanel supposed to be about future of cars in andlt years. was mostly about driverless in . lots will happen before then
3,do you think driver less cars are the future of transportation?
3,space shuttle simulator check. driverless car simulator check.
3,pardon me future... go right ahead. via driverless driverlesscar google
3,interesting thought experiment on ethics of driverless car.
3,google is already trying to deploy driverless taxi fleets it makes sense they want to automate other industries enter bostondynamics
3,driverless cab nyc brooklyn bridge
3,what about manhattan or should cleveland should build spaces to temporary store your driverless car?
3,driverless cars technology trumps experience again edtech edchat txed
3,esp rito santo state university uses ubuntu for developing the driverless car in brazil linux
3,insurance forum on the future of insurance client communication and driverless cars! royal ontario museum
3,volvo is about to put driverless cars on the road in sweden by ben schiller via no!
3,will driverless cars eventually replace taxi drivers?
3,britain starting driverless car tests next year epoch times yes!!!
3,tesla talking to google about driverless electric cars via
3,the google driverless cars should have an i'm feeling lucky button that takes you to a random location.
3,google's driver less car has no steering wheel no brake petal andamp no gas petal
3,when the time came i knew it'd look like an egg google unveils driverless car
3,the fbi thinks driverless cars could be deadly tha fuck
3,u.k. science minister races to legalize driverless cars by cc
3,burkhard bilger inside google s driverless car.
3,wireless skins accident proof trains and driverless cars hitachi cto hu yoshida by bigdata via
3,interesting white paper on how driverless cars could affect auto insurers thanks anne great insight
3,driverless cars in colorado? lawmakers may allow them denver ap colorado lawmakers are debating a change in...
3,watch google's driverless car in action via
3,. driverless car tested in merced. that's just the beginning rockets drones
3,google to build prototype of truly driverless car google plans to build and launch onto city streets a small...
3,rt are we ready for driverless cars? pbs newshour
3,does google's driverless car mean the kids can take themselves to school? no more pushy parents in bmws or escalades?
3,live tweeting screen at cas . in the future we ll all have driverless cars and one of these.
3,i wonder if driverless car is going to sound as archaic as horseless carriage years from now.
3,ford gm toyota join u m s driverless vehicle test ann arbor mich. ap the university of michigan says...
3,my family back in fl own three cars now driverless cars andamp tampa regional rail would let them own .
3,a driverless car invented by google has completed over k miles and only had two accidents when humans in other cars hit it.
3,can driverless cars be the cure to traffic?
3,trying to gauge the unintended consequences of driverless cars the future of driving via
3,really i consider a subway to be a driverless car.
3,is this cover only about driverless cars or also about the ?? donothingcongress teabagtreason
3,google forced to add steering wheels to driverless car designs we were just talking about this.
3,uk to let driverless cars loose on roads by january where we're going we don't need roads thefuture
3,driverless car mobile lidar mt another use for driverlesscars besides transport via
3,driverless cars bill is signed
3,solarinfrastructure solar electric car andamp truck mini car alliance with google to make driverless car. solarelect plane...
3,james bond will ride in a driverless aston martin that incapacitates villains with nerf bullets and silly string.
3,looking for a completely driverless camry? sorry but toyota believes control should remain with the
3,ai is the future it will at the heart of driverless cars and autonomous devices.
3,until driverless cars... brings google glass hcd experience to your windshield! ht
3,driverless golf carts
3,california becomes third state to legalize driverless cars. rt
3,i hacked my driverless car so now it just drives the streets at night alone wondering where the time went why we're here how it will end
3,just imagine you got pull over with a driver less lapd car n got a mms incl. your citation violation ft.
3,visionzero actonclimate net zero best nyt google s next phase in driverless cars no brakes or steering wheel
3,at high speed on the road to a driverless future via interesting but what if the camera's lenses get dirty
3,blind man drives google driverless car. automotive aid
3,neil driverless cars in andlt yrs. everyone else lol wrong. reality
3,google's driverless car in action. here we go
3,google to build prototype of truly driverless car
3,years away until we see it on road it will be legal for driverless cars to drive in california soon
3,google driverless car is magnitudes harder tech challenge vs. tech powered diagnoses. which is more important? hisum
3,google's new driverless car has no brake pedal or steering wheel fuck
3,google reveals driverless car prototype... skynet cc
3,test driving google's driverless car look mom no hands
3,tudetroit by will driverless cars replace taxis and delivery vehicles? butler it's going to happen.
3,it's just like a turing test for driverless autos. the founding fathers had some serious foresight!
3,oh then your car must be driverless. those bumper stickers were right all along.
3,cool!! as google dreams of driverless cars idf deploys them via
